filename,notes,authors,licenses,urls
"body/bodies/female/walk/olive.png","see details at https://opengameart.org/content/lpc-character-bases","Benjamin K. Smith (BenCreating), bluecarrot16, TheraHedwig, Evert, MuffinElZangano, Durrani, Pierre Vigier (pvigier), ElizaWy, Matthew Krohn (makrohn), Johannes Sjölund (wulax), Stephen Challener (Redshrike)","OGA-BY 3.0, CC-BY-SA 3.0, GPL 3.0","https://opengameart.org/content/liberated-pixel-cup-lpc-base-assets-sprites-map-tiles, https://opengameart.org/content/lpc-medieval-fantasy-character-sprites, https://opengameart.org/content/lpc-ladies, https://opengameart.org/content/lpc-7-womens-shirts, https://opengameart.org/content/lpc-jump-expanded, https://opengameart.org/content/lpc-be-seated, https://opengameart.org/content/lpc-revised-character-basics, https://gitlab.com/vagabondgame/lpc-characters, https://opengameart.org/content/lpc-male-jumping-animation-by-durrani, https://opengameart.org/content/lpc-runcycle-and-diagonal-walkcycle"
"head/heads/human/female_small/walk/olive.png","original head by Redshrike, reduced size head by ElizaWy","ElizaWy, Stephen Challener (Redshrike)","OGA-BY 3.0, CC-BY",""
"head/faces/female/neutral/walk/olive.png","Original by Redshrike, Expressions by ElizaWy, mapped to all frames by JaidynReiman","JaidynReiman, ElizaWy, Stephen Challener (Redshrike)","OGA-BY 3.0","https://github.com/ElizaWy/LPC/tree/main/Characters/Head, https://opengameart.org/content/ulpc-expanded-expressions"
"eyes/human/${head}/neutral/walk/brown.png","original by Redshrike, mapped to all frames by Matthew Krohn & JaidynReiman","JaidynReiman, Matthew Krohn (makrohn), Stephen Challener (Redshrike)","OGA-BY 3.0, CC-BY-SA 3.0, GPL 3.0","https://opengameart.org/content/liberated-pixel-cup-lpc-base-assets-sprites-map-tiles"
"hair/loose/adult/walk/black.png","","JaidynReiman, Manuel Riecke (MrBeast)","CC-BY-SA 3.0, GPL 3.0","https://opengameart.org/content/liberated-pixel-cup-lpc-base-assets-sprites-map-tiles, https://opengameart.org/content/lpc-expanded-hair"
"dress/kimono/normal/universal/female/walk/sky.png","","JaidynReiman, Stephen Challener (Redshrike), Johannes Sjölund (wulax)","OGA-BY 3.0+, CC-BY 3.0+, GPL 3.0","https://opengameart.org/content/lpc-kimono-relm"
"feet/sandals/thin/walk/navy.png","edited for v3 bases by bluecarrot16, Jump/Sit/Emote/Run/Revised Combat by JaidynReiman","Nila122, JaidynReiman, Matthew Krohn (makrohn), Johannes Sjölund (wulax)","OGA-BY 3.0, CC-BY-SA 3.0, GPL 2.0, GPL 3.0","https://opengameart.org/content/lpc-roman-armor, http://opengameart.org/content/lpc-clothing-updates, https://opengameart.org/content/lpc-expanded-socks-shoes"
