filename,notes,authors,licenses,urls
"body/bodies/female/walk/amber.png","see details at https://opengameart.org/content/lpc-character-bases","Benjamin K. Smith (BenCreating), bluecarrot16, TheraHedwig, Evert, MuffinElZangano, Durrani, Pierre Vigier (pvigier), ElizaWy, Matthew Krohn (makrohn), Johannes Sjölund (wulax), Stephen Challener (Redshrike)","OGA-BY 3.0, CC-BY-SA 3.0, GPL 3.0","https://opengameart.org/content/liberated-pixel-cup-lpc-base-assets-sprites-map-tiles, https://opengameart.org/content/lpc-medieval-fantasy-character-sprites, https://opengameart.org/content/lpc-ladies, https://opengameart.org/content/lpc-7-womens-shirts, https://opengameart.org/content/lpc-jump-expanded, https://opengameart.org/content/lpc-be-seated, https://opengameart.org/content/lpc-revised-character-basics, https://gitlab.com/vagabondgame/lpc-characters, https://opengameart.org/content/lpc-male-jumping-animation-by-durrani, https://opengameart.org/content/lpc-runcycle-and-diagonal-walkcycle"
"head/heads/human/female_small/walk/amber.png","original head by Redshrike, reduced size head by ElizaWy","ElizaWy, Stephen Challener (Redshrike)","OGA-BY 3.0, CC-BY",""
"head/faces/female/neutral/walk/amber.png","Original by Redshrike, Expressions by ElizaWy, mapped to all frames by JaidynReiman","JaidynReiman, ElizaWy, Stephen Challener (Redshrike)","OGA-BY 3.0","https://github.com/ElizaWy/LPC/tree/main/Characters/Head, https://opengameart.org/content/ulpc-expanded-expressions"
"feet/shoes/basic/thin/walk/leather.png","original by wulax, edited for v3 base by bluecarrot16, Jump/Sit/Emote/Run/Revised Combat by JaidynReiman","JaidynReiman, bluecarrot16, Johannes Sjölund (wulax)","OGA-BY 3.0, CC-BY-SA 3.0, GPL 3.0","https://opengameart.org/content/lpc-medieval-fantasy-character-sprites, http://opengameart.org/content/lpc-clothing-updates, https://opengameart.org/content/lpc-expanded-socks-shoes"
"head/wrinkles/walk/amber.png","","bluecarrot16","CC0",""
"hair/dreadlocks_long/adult/walk/raven.png","","bluecarrot16","CC0","https://opengameart.org/content/lpc-hair"
"eyes/eyebrows/thick/adult/walk/raven.png","","ElizaWy","OGA-BY 3.0","https://github.com/ElizaWy/LPC/tree/main/Characters/Hair, https://opengameart.org/content/lpc-expanded-sit-run-jump-more"
"legs/leggings/thin/walk/green.png","Original bases by Redshrike, thrust/shoot bases by Wulax, adapted from sara's leggings to v3 bases by bluecarrot16, jump/run/sit by JaidynReiman based on ElizaWy's and modified to match","bluecarrot16, ElizaWy, JaidynReiman, Mandi Paugh, William.Thompsonj, Johannes Sjölund (wulax), Stephen Challener (Redshrike)","OGA-BY 3.0","http://opengameart.org/content/sara-wizard, https://opengameart.org/content/lpc-sara, https://opengameart.org/content/lpc-expanded-pants"
"torso/clothes/longsleeve/longsleeve2_cardigan/female/walk/maroon.png","original by ElizaWy; spellcast/thrust/shoot/hurt/male adapted from original by JaidynReiman","ElizaWy, JaidynReiman, Stephen Challener (Redshrike), Johannes Sjölund (wulax)","OGA-BY 3.0","http://opengameart.org/content/lpc-revised-character-basics, https://github.com/ElizaWy/LPC/tree/main/Characters/Clothing, https://opengameart.org/content/lpc-expanded-sit-run-jump-more, https://opengameart.org/content/lpc-expanded-simple-shirts"
